{
  "$schema": "../preset.schema.json",
  "name": "deepwiki-search-conversation",
  "summary": "DeepWiki persisted /search/ conversation: ordered Q&A rounds with citations",
  "domain": "deepwiki.com",
  "mode": "content",
  "url_patterns": ["^https?://(?:www\\.)?deepwiki\\.com/search/[\\w-]+/?(?:\\?.*)?$"],
  "handler": "deepwiki.scrape_search_conversation",
  "schema": "DeepWikiSearchConversation"
}
